{
  "policy": {
    "name": "synthetic-open-discovery-pilot-v1",
    "usdc_asset": "simulation:USDC",
    "opens_at": 0,
    "submissions_close_at": 100,
    "appeals_close_at": 200,
    "review_deadline": 300,
    "maximum_submissions": 100,
    "maximum_appeals": 20,
    "verification_fee_units": 1000000,
    "appeal_fee_units": 2000000,
    "assessors": [
      "xloperator:blake3:b6203ec080398fad0b9cae2e466db925e14b49e22c1440ca676a47a92d0c0d3c",
      "xloperator:blake3:3f77e3bf272dc0ed7b5f1d9f861a5cb349ca15dc28b16e724a4e401c40d2aff1"
    ],
    "appeal_reviewers": [
      "xloperator:blake3:26ad13ef3ab1b2a5684589878cb85b402dc124f1839dac43d8516ca03168b5b8",
      "xloperator:blake3:c62cf65c55d5d6243083ca192e470e1b7fb3de9f8d24e4c188cd80d6de75d8b1"
    ],
    "budgets": {
      "discovery": {
        "solver_units": 300000000,
        "verification_units": 100000000,
        "appeal_units": 50000000,
        "maximum_weight": 1000
      },
      "formalization": {
        "solver_units": 300000000,
        "verification_units": 100000000,
        "appeal_units": 50000000,
        "maximum_weight": 1000
      },
      "proof_improvement": {
        "solver_units": 300000000,
        "verification_units": 100000000,
        "appeal_units": 50000000,
        "maximum_weight": 1000
      },
      "replication": {
        "solver_units": 300000000,
        "verification_units": 100000000,
        "appeal_units": 50000000,
        "maximum_weight": 1000
      },
      "research_tools": {
        "solver_units": 300000000,
        "verification_units": 100000000,
        "appeal_units": 50000000,
        "maximum_weight": 1000
      },
      "negative_result": {
        "solver_units": 300000000,
        "verification_units": 100000000,
        "appeal_units": 50000000,
        "maximum_weight": 1000
      }
    },
    "profiles": [
      {
        "policy_id": "xlpolicy:blake3:b92231fc15698337333b5f92efba1256623a115a832bf4f7a265f3c17f8abc1a",
        "class": "formal",
        "required_evidence": [
          "formal_statement",
          "proof_object",
          "pinned_toolchain",
          "axiom_inventory"
        ],
        "verifier_implementations": [
          "synthetic-independent-a",
          "synthetic-independent-b"
        ],
        "minimum_reproductions": 2,
        "minimum_independent_operators": 2,
        "challenge_window_seconds": 100,
        "policy_root": "blake3:b92231fc15698337333b5f92efba1256623a115a832bf4f7a265f3c17f8abc1a"
      },
      {
        "policy_id": "xlpolicy:blake3:d9d8e2c475ddb0b0e5ff632d77f25f680287994288b1ee1163d33c2545368b47",
        "class": "computational",
        "required_evidence": [
          "reproducible_source",
          "execution_environment",
          "dependency_lock",
          "deterministic_rerun"
        ],
        "verifier_implementations": [
          "synthetic-independent-a",
          "synthetic-independent-b"
        ],
        "minimum_reproductions": 2,
        "minimum_independent_operators": 2,
        "challenge_window_seconds": 100,
        "policy_root": "blake3:d9d8e2c475ddb0b0e5ff632d77f25f680287994288b1ee1163d33c2545368b47"
      },
      {
        "policy_id": "xlpolicy:blake3:426e732d555fa291dbdf7a88f3c5d8ce9a9cbbb40f0b4963b49ecf9077356b72",
        "class": "empirical",
        "required_evidence": [
          "protocol_registration",
          "instrument_manifest",
          "data_lineage",
          "independent_replication",
          "dataset_provenance",
          "analysis_plan",
          "uncertainty_report",
          "robustness_checks"
        ],
        "verifier_implementations": [
          "synthetic-independent-a",
          "synthetic-independent-b"
        ],
        "minimum_reproductions": 2,
        "minimum_independent_operators": 2,
        "challenge_window_seconds": 100,
        "policy_root": "blake3:426e732d555fa291dbdf7a88f3c5d8ce9a9cbbb40f0b4963b49ecf9077356b72"
      }
    ],
    "assessment_policy_root": "xla:blake3:938f9713c310d13d1144aca3f0234beba7ab8b30bf4ec24ca5476f163a54c348"
  },
  "funding": [
    {
      "settlement_receipt_id": "xlr:blake3:186aa7393341ec5540e3cd318a291e6de874d5b76df47a1cec4aacb8992e6e2f",
      "donor_cluster": "xloperator:blake3:a612372446bfa37f86f8ac709a09f0400a13ab6fa9d9cad6cc2c3c42cbeaa31b",
      "administrator_cluster": "xloperator:blake3:4194d1706ed1f408d5e02d672777019f4d5385c766a8c6ca8acba3167d36a7b9",
      "category": "discovery",
      "gross_units": 500000000,
      "administrator_fee_units": 10000000,
      "mandate_root": "xla:blake3:6c50b5519b39f8344b6df1c3d2d272e52b68f718e18346a6bb8e12e092dc9ff3"
    },
    {
      "settlement_receipt_id": "xlr:blake3:1a7dcef2da1679149fe4d2eec0771b1e9697bb68f7e403b7d331e520c426f9e4",
      "donor_cluster": "xloperator:blake3:6a8f6058339af309ef6893d89a133123255059c30d7b1fa9a67864e18a14403d",
      "administrator_cluster": "xloperator:blake3:4194d1706ed1f408d5e02d672777019f4d5385c766a8c6ca8acba3167d36a7b9",
      "category": "formalization",
      "gross_units": 500000000,
      "administrator_fee_units": 10000000,
      "mandate_root": "xla:blake3:f29722dff409dcbd1a416543646400c2d5c233030f3c65fdd2aa1923e61ea4c6"
    },
    {
      "settlement_receipt_id": "xlr:blake3:71ab19d61e7d8148049e7c163d6cc8bf9354c0906d83242a31760f4c745bbd0b",
      "donor_cluster": "xloperator:blake3:01939bb7eca612fd1047e3959fee313f07795aa6c291f171f796123d6eb6e60c",
      "administrator_cluster": "xloperator:blake3:4194d1706ed1f408d5e02d672777019f4d5385c766a8c6ca8acba3167d36a7b9",
      "category": "proof_improvement",
      "gross_units": 500000000,
      "administrator_fee_units": 10000000,
      "mandate_root": "xla:blake3:6740228137b2cd4244d2cc9353faeddf163f9c1011f6bdf62a88a9497b905a82"
    },
    {
      "settlement_receipt_id": "xlr:blake3:ccfccf035865e4ba14c9f5ef43aa44acfaa0151f379367db8c650655c9a92e2d",
      "donor_cluster": "xloperator:blake3:a612372446bfa37f86f8ac709a09f0400a13ab6fa9d9cad6cc2c3c42cbeaa31b",
      "administrator_cluster": "xloperator:blake3:4194d1706ed1f408d5e02d672777019f4d5385c766a8c6ca8acba3167d36a7b9",
      "category": "replication",
      "gross_units": 500000000,
      "administrator_fee_units": 10000000,
      "mandate_root": "xla:blake3:1083cb94884180dc41a8e4f821f311e629004695735342fbca37740e7e8142a9"
    },
    {
      "settlement_receipt_id": "xlr:blake3:bc4a500a3169607a22d9be378013ede40ac90f4be5f6bc5a72ff91d4fdc8d410",
      "donor_cluster": "xloperator:blake3:6a8f6058339af309ef6893d89a133123255059c30d7b1fa9a67864e18a14403d",
      "administrator_cluster": "xloperator:blake3:4194d1706ed1f408d5e02d672777019f4d5385c766a8c6ca8acba3167d36a7b9",
      "category": "research_tools",
      "gross_units": 500000000,
      "administrator_fee_units": 10000000,
      "mandate_root": "xla:blake3:4d683a047fdfb28ee45516b789d3e9fe2cca442d576d5ce7667f4df91cfd90bd"
    },
    {
      "settlement_receipt_id": "xlr:blake3:f8244149bf90824c0a170da537124aed361e2980b70452e1d692e52f0baf4890",
      "donor_cluster": "xloperator:blake3:01939bb7eca612fd1047e3959fee313f07795aa6c291f171f796123d6eb6e60c",
      "administrator_cluster": "xloperator:blake3:4194d1706ed1f408d5e02d672777019f4d5385c766a8c6ca8acba3167d36a7b9",
      "category": "negative_result",
      "gross_units": 500000000,
      "administrator_fee_units": 10000000,
      "mandate_root": "xla:blake3:2305b9729ae0afafd51ee41264b7b107e41dcb788e98b205e3dd2221795a9bb3"
    }
  ],
  "pledged_units": 1000000000,
  "previously_rewarded_groups": [],
  "previously_rewarded_claims": {},
  "previously_consumed_settlements": [],
  "events": [
    {
      "kind": "submit",
      "at": 1,
      "submission": {
        "submission_id": "xlr:blake3:062c55ab3d112c77170ea00c8bcc11496027d75f367165dfb928cf3ed9bec793",
        "group_id": "xlgroup:blake3:289f8b01adac7224101aeba7f153c572c3def3c9d6205ee795a689df07f5d419",
        "category": "discovery",
        "claims": [
          "xlc:blake3:c461c624433276c4ec3053bd6599e2f21f74e27422b0542b2aae536137a04f0d"
        ],
        "contributors": [
          {
            "researcher_id": "xlresearcher:blake3:604c7a8af9cd126e29ba34aee3c2e9c043478c7575ba54fb1b490f8c823e594a",
            "operator_cluster_id": "xloperator:blake3:752d056be67a18d60b70c88f77e551cb49afa3eda034a384c57dfb100e4e6bce",
            "share_bps": 7000
          },
          {
            "researcher_id": "xlresearcher:blake3:8174cf683db6754b07d23f443f1c954133d322e558307f4697a33b067c0a9798",
            "operator_cluster_id": "xloperator:blake3:8174cf683db6754b07d23f443f1c954133d322e558307f4697a33b067c0a9798",
            "share_bps": 3000
          }
        ],
        "contribution_manifest_root": "xla:blake3:648dab06aeec85ed6152c20ec335a9d3034be5a18f56c34285d81abd7b72019b",
        "profile_id": "xlpolicy:blake3:b92231fc15698337333b5f92efba1256623a115a832bf4f7a265f3c17f8abc1a",
        "evidence_roots": {
          "formal_statement": "xla:blake3:a0b4931dbb06f8fd71aac0aaef2e22e9e1d1a4fc93b68fc465c46286ed6cbea2",
          "proof_object": "xla:blake3:bad244648de8738985fdf1aedfe0c5232903c18abe21dc5b17716afdfa41a9eb",
          "pinned_toolchain": "xla:blake3:56f91cb6f7ffc97c7ce73cd3e9ea3a356fb18fb17025b85abac7cd08964ede0c",
          "axiom_inventory": "xla:blake3:86707d2f7557a7b3aa3eeb216a83f12bfb917d9a1649fa1f99fc48951991cd6f"
        },
        "declared_evidence_status": "supported",
        "reward_eligible": true,
        "assessed_weight": 100,
        "assessment_root": "xla:blake3:2ebff6565f6eea88af296072cd53b5ea04dbcfc12c6af05f3e3fc8420886fcab",
        "assessors": [
          "xloperator:blake3:b6203ec080398fad0b9cae2e466db925e14b49e22c1440ca676a47a92d0c0d3c",
          "xloperator:blake3:3f77e3bf272dc0ed7b5f1d9f861a5cb349ca15dc28b16e724a4e401c40d2aff1"
        ],
        "reported_tokens": 10000,
        "reported_compute_units": 1000000,
        "registered_study": null
      }
    },
    {
      "kind": "submit",
      "at": 2,
      "submission": {